{
  "job_id": "aff7c591-0a62-59aa-8292-66b2a871c79c",
  "tenant_id": "286ea0c9-1360-5574-84ae-b88f28527610",
  "reset_epoch": 1,
  "workflow_id": "beedb39b-bf5b-5e09-8b6a-35d3c847c4ee",
  "kind": "finalize_document",
  "dedupe_key": "synthetic_dedupe_key",
  "state": "ready",
  "expected_state_version": 10,
  "input_refs": [
    "f660de0e-5a11-5782-ba17-46d096f61d03"
  ],
  "available_at": "2026-09-26T17:00:00Z",
  "attempt_count": 0,
  "max_attempts": 3,
  "lease_owner": null,
  "lease_epoch": 0,
  "lease_expires_at": null,
  "deadline_at": "2026-09-26T17:05:00Z",
  "run_id": null,
  "last_error": null,
  "created_at": "2026-09-26T17:00:00Z"
}
